{
  "event_id": "880e8400-e29b-41d4-a716-446655440003",
  "schema_version": "1.0.0",
  "fid": 12345,
  "username": "faithful_giver",
  "verified_address": "0x1234567890123456789012345678901234567890",
  "frame_action": "tithe",
  "frame_uri": "https://biblefi.io/frames/tithe/malachi-3-10",
  "cast_hash": "0xcast123abc",
  "channel_id": "/biblefi",
  "timestamp": "2026-03-30T03:00:00Z",
  "button_index": 1,
  "connected_wallet": "0x1234567890123456789012345678901234567890",
  "chain_id": 8453,
  "biblefi_action": {
    "action_type": "tithe_initiate",
    "scripture_record_id": "550e8400-e29b-41d4-a716-446655440000",
    "amount_wei": "10000000",
    "asset_symbol": "USDC",
    "estimated_gas_wei": "50000000000000"
  },
  "created_at": "2026-03-30T03:00:00Z"
}
